{
  "schema_version": "1.0",
  "plan_id": "orientation-layer",
  "title": "Orientation layer — collapse repeated exact transforms",
  "objective": "Replace per-action transform layers with one orientation layer holding the composed exact state, updated in place while it is the last layer of the stack, so any number of rotations and reflections leave one layer.",
  "context_summary": "Accepted by the owner on 2026-09-20 for immediate implementation. Effect lightwell.geometry.orientation, payload {mirror, turns}, mirror first then clockwise quarter-turns. The four actions keep their durable history identities, controls and API. Plan updates the last layer when it is an orientation layer, else commits a new one. The old transform effect is removed and stacks holding it are refused explicitly. Coordinated with the content-space edits work, which places pixel layers before geometry layers; run after it lands so the host placement rule and this plan share one tree.",
  "tasks": [
    {
      "id": "TASK-001",
      "description": "Implement the orientation layer in the core: payload, composition, planning rule, exact compile, and every fixture and journey that built transform layers.",
      "status": "ready",
      "dependencies": [],
      "extra_context": [
        "Replace Layer::transform and the TRANSFORM_EFFECT constant with an orientation payload and constructor; keep the Transform enum as the action vocabulary. Composition table and geometry are in the design.",
        "Renderer, editor, registry, command contract, acceptance and performance code build transform layers today; move them to the orientation constructor and keep every existing identity, ordering, interleaving and EXIF proof passing with the new representation.",
        "Do not add layer removal. Reaching neutral leaves a neutral layer."
      ],
      "context_links": [
        {
          "kind": "file",
          "label": "Design",
          "target": "docs/design/orientation-layer.md",
          "relevance": "Payload, composition table and planning rule."
        },
        {
          "kind": "file",
          "label": "Transform module",
          "target": "crates/lightwell-core/src/modules/transform.rs",
          "relevance": "The module to change; its geometry function composes the mapping."
        },
        {
          "kind": "file",
          "label": "Model",
          "target": "crates/lightwell-core/src/model.rs",
          "relevance": "Effect constants, Transform enum and layer constructors."
        },
        {
          "kind": "file",
          "label": "Renderer tests",
          "target": "crates/lightwell-core/src/render.rs",
          "relevance": "Identity, ordering and interleaving proofs that must keep passing."
        }
      ],
      "acceptance_criteria": [
        "Four Rotate right actions leave one neutral orientation layer, four entries and a byte-identical render; undo steps back through the intermediate orientations.",
        "Every sequence of up to three actions renders byte-identically to the stepwise reference on synthetic and EXIF-mirrored fixtures.",
        "A transform after a crop appends; a further transform updates that layer; the crop composition is carried as the crop spec describes.",
        "Stacks holding the old transform effect are refused as an unavailable effect without being rewritten.",
        "Performance checklist answered: composition is integer arithmetic; no new allocation in planning or rendering."
      ],
      "test_strategy": {
        "approach": "unit",
        "steps": [
          "Module tests for the composition table over all eight states and four actions.",
          "Editor tests for the update-versus-commit rule with and without a crop, and for the four-rotation collapse with undo.",
          "Rerun the renderer proofs with orientation layers."
        ],
        "commands": [
          "cargo xtask check"
        ],
        "expected_results": [
          "All proofs pass with the new representation."
        ]
      }
    },
    {
      "id": "TASK-002",
      "description": "Update the specs, feature status and user guide, and verify on the M4 Mac.",
      "status": "pending",
      "dependencies": [
        "TASK-001"
      ],
      "extra_context": [
        "History spec transform section, module contract, crop spec references to transforms, feature status rows for M2 and M3, and the user guide's transform paragraph describe the orientation layer. Current behavior only.",
        "Extend the editor acceptance run with the four-rotation collapse and run a background smoke with correlated state and logs."
      ],
      "context_links": [
        {
          "kind": "file",
          "label": "History spec",
          "target": "docs/specs/edit-history.md",
          "relevance": "Exact transform section."
        },
        {
          "kind": "file",
          "label": "User guide",
          "target": "docs/user-guide.md",
          "relevance": "Transform paragraph."
        },
        {
          "kind": "file",
          "label": "Editor acceptance",
          "target": "xtask/src/editor_acceptance.rs",
          "relevance": "Headless journey to extend."
        }
      ],
      "acceptance_criteria": [
        "Docs match the shipped contract and name no old transform effect.",
        "cargo xtask check, the acceptance run and a background smoke pass with evidence; the plan file is deleted and feature status records the outcome."
      ],
      "test_strategy": {
        "approach": "end-to-end",
        "steps": [
          "Run the headless acceptance and the background smoke on the M4 Mac; inspect docs against code."
        ],
        "commands": [
          "cargo xtask check",
          "cargo xtask editor-acceptance",
          "cargo xtask smoke"
        ],
        "expected_results": [
          "Checks pass and evidence shows one orientation layer after four rotations."
        ]
      }
    }
  ],
  "execution_waves": [
    {
      "wave": 1,
      "task_ids": [
        "TASK-001"
      ]
    },
    {
      "wave": 2,
      "task_ids": [
        "TASK-002"
      ]
    }
  ]
}
