{
  "schema_version": "1.0",
  "plan_id": "lightroom-research",
  "title": "Lightroom Classic technical research",
  "objective": "Maintain the sourced Lightroom Classic storage, rendering, performance and editing-tool knowledge base as independent research context for later Lightwell decisions.",
  "context_summary": "Lightroom research. Renumbered locally in dependency order on 2026-09-20 at the owner's request. Statuses and completed evidence are preserved; the exact previous plan is archived. TASK IDs have meaning only inside this file. The current editor sequence is history foundation, transforms, tool modules and crop; milestones are described by named outcomes in the roadmap. This research changes no application capability or accepted product decision.",
  "tasks": [
    {
      "id": "TASK-001",
      "description": "Research and document Lightroom Classic storage, rendering, performance and editing-tool behavior in a sourced knowledge base.",
      "status": "completed",
      "dependencies": [],
      "extra_context": [
        "User explicitly requested online research and documentation, not implementation of Lightroom features.",
        "Separate documented product behavior from conceptual algorithms and unpublished internals; preserve current milestone scope.",
        "Completed 2026-09-20: 13 Markdown files and 44 cited sources. Both task validators, local links, research anchors, citation IDs and cargo xtask check passed (26 tests; one existing helper ignored). An initial concurrent S0 task-status mismatch was resolved by that separate update before the successful rerun. See research-plan.md for verification scope."
      ],
      "context_links": [
        {
          "kind": "file",
          "label": "Lightroom research plan",
          "target": "docs/research/lightroom/research-plan.md",
          "relevance": "Defines scope, evidence policy, acceptance and unknowns."
        },
        {
          "kind": "file",
          "label": "Lightroom knowledge base",
          "target": "docs/research/lightroom/README.md",
          "relevance": "Completed sourced chapters, comparison tables, algorithm explanations, limitations and proposed experiments."
        }
      ],
      "acceptance_criteria": [
        "Provide a navigable Markdown knowledge base with source register covering storage/history, rendering/color, previews/performance, tool semantics and SDK boundaries.",
        "Explain Contrast, Clarity and Texture distinctly; label exact proprietary algorithms and performance internals that remain unknown.",
        "Record version-sensitive evidence and Lightwell proposals without changing accepted feature scope or marking app features implemented.",
        "Run every active task validator and documentation checks; record any unrelated repository-wide blockers separately from research-artifact results."
      ],
      "test_strategy": {
        "approach": "inspection",
        "steps": [
          "Read primary sources and inspect citations against chapter claims.",
          "Check local links, source inventory, uncertainty labels and preservation of existing task states."
        ],
        "commands": [
          "cargo xtask check"
        ],
        "expected_results": [
          "A sourced, internally linked research reference; no application changes or unmeasured performance claims."
        ]
      }
    }
  ],
  "execution_waves": [
    {
      "wave": 1,
      "task_ids": [
        "TASK-001"
      ]
    }
  ]
}
